question,cls
สอบถามผู้รู้เกี่ยวกับการกรอกข้อมูล ยื่นภาษีเงินได้บุคคลธรรมดา ค่ะ ,1
หุ้นเวียดนามเจ๊งขนาดนี้ นักลงทุนเขาอยู่กันยังไงครับ,1
มีใครเคยเอา Krungsri Boarding Card ไปใช้ที่ญี่ปุ่นมั่งครับ,1
AIA เขาจ่ายเงินเดือนกันยังไง,1
truemoney wallet ดูยอดรวมของค่าธรรมเนียมรับเงินทั้งหมด ตรงไหนครับ,1
คนที่เคยไปอยู่จีน คิดว่ารวมๆแล้วคนจีนอยู่ดีกว่าและรายได้ดีกว่าคนไทยมั้ยครับ,1
ถ้าฝากเงินในบัญชีไว้นานๆโดย ไม่ถอนไม่มีการเคลื่อนไหว จะถูกปิดไหม,1
จะผ่อนรถต่อแต่เจ้าไม่อยู่ต้องทำไงครับ,1
ทำบัตรเครดิตยากไหมครับ,1
