question,cls
บทลงโทษตามความผิดของ พรบ. หลักทรัพย์และตลาดหลักทรัพย์ มีอะไรบ้าง,0
ใครเป็นผู้ออกตราสารหนี้ภาครัฐ ไร้ใบตราสาร,0
ตราสารศุกูก (Sukuk) คืออะไร,0
Value Stock หุ้นคุณค่า มีลักษณะอบ่างไร,0
ขายตราสารหนี้ เมื่อใด,0
REITs คืออะไร,0
Cap คืออะไร,0
Blue-Chip Stock หุ้นใหญ่แข็งแกร่ง มีลักษณะอย่างไร,0
ราคาหุ้นสามัญลดลง ส่งผลอย่างไรกับราคาหุ้นกู้แปลงสภาพ,0
ประโยชน์ของกองทุนรวมต่อผู้ลงทุน คืออะไร,0
MLR (Minimum Load Rate) คืออะไร,0
กองทุนรวม ETF (Exchange Trade Fund) คืออะไร,0
การขอเปิดบัญชีหลักทรัพย์ต้องมีข้อมูลเกี่ยวกับลูกค้าอะไรบ้าง,0
กองทุนรวมแบบมีประกัน (Guarantee Fund) คืออะไร,0
ประเภทของธุรกิจในไทย มีกี่ประเภท,0
ความเสี่ยงจากความผันผวนของราคากองทุน (Market risk) คืออะไร,0
SETSMART Enterprise มีอะไรบ้าง,0
หากผู้ลงทุนคาดว่าอัตราเงินเฟ้อในอนาคตจะสูงขึ้น จะส่งผลอย่างไร,0
ผู้ค้าตราสารหนี้สร้างรายได้จากที่ใด,0
หุ้นกู้ระหว่างประเทศ (International Bond) คืออะไร,0
Equity-Linked Product ที่ซื้อขายในตลาดหลักทรัพย์ มีประเภทใดบ้าง,0
เกณฑ์ในการแบ่งประเภทหุ้นสามัญมีอะไรบ้าง,0
สำนักงานคณะกรรมการกำกับหลักทรัพย์และตลาดหลักทรัพย์ (ก.ล.ต.) มีหน้าที่อะไร,0
12.30 – 14.00 น. มีรายละเอียดอย่างไร,0
การประเมินมูลค่าของ DW มีอะไรบ้าง,0
ลักษณะของธุรกรรมซื้อคืน มีอะไรบ้าง,0
กองทุนตราสารหนี้ (General Fixed Income Fund) คืออะไร,0
ลักษณะการซื้อขายที่ไม่เป็นธรรมตามข้อกฎหมายของ พรบ. หลักทรัพย์และตลาดหลักทรัพย์ มีอะไรบ้าง,0
ใครคือผู้ออกตราสาร DW,0
เอกสารแนบ คืออะไร,0
การชำระราคาและส่งมอบหลักทรัพย์แบบทีละรายการ (Gross Clearing) คืออะไร,0
กรณีบริษัทล้มละลาย ลำดับในการได้รับเงินมีอะไรบ้าง,0
การประเมินมูลค่าตราสารหนี้ หมายถึงอะไร,0
ตราสารหนี้ที่ไม่กำหนดอายุไถ่ถอน (Perpetual Bond) คืออะไร,0
การปรับสิทธิเมื่อปันผลของDW เป็นอย่างไร,0
ข้อมูลจากตลาดหลักทรัพย์ มีอะไรบ้าง,0
ลักษณะของห้างหุ้นส่วนสามัญ คืออะไร,0
ลักษณะของบริษัทจำกัด คืออะไร,0
การประเมินมูลค่าตราสารหนี้ทั่วไป ทำอย่างไร,0
ลักษณะสำคัญของกองทุนรวมสินค้าโภคภัณฑ์ มีอะไรบ้าง,0
ทำไมจึงต้องติดตามภาวะการซื้อขาย,0
รูปแบบการจัดจำหน่ายหลักทรัพย์ มีกี่รูปแบบ,0
ตราสารหนี้ที่ไม่จ่ายดอกเบี้ย (Zero Coupon Bond) คืออะไร,0
Limit Price Order คืออะไร,0
การกำกับดูแลการซื้อขายที่ดีส่งผลต่อบริษัทสมาชิก (บล.) อย่างไร,0
Net Asset Value (มูลค่าทรัพย์สินสุทธิ) คืออะไร,0
หลักการกำกับดูแลให้เกิดความเป็นธรรมแก่ผู้ลงทุนและผู้เกี่ยวข้องทุกฝ่าย มีกี่แนวทาง,0
การลงทุนแบบถัวเฉลี่ยต้นทุน (Dollar-Cost Averaging: DCA) มีวิธีการลงทุนอย่างไร,0
ผู้ลงทุนสามารถตัดสินใจซื้อเมื่อใด,0
นายหน้าค้าตราสารหนี้ มีรายได้จากส่วนใด,0
NP หมายถึงอะไร,0
ตราสารหนี้ภาครัฐ คืออะไร,0
บัญชีเงินสดแบบมีหลักประกันเต็มจำนวน (Cash Balance) คืออะไร,0
DW มี Credit Risk หรือไม่,0
การลงทุนในทิศทางที่ตรงข้ามกับคนส่วนใหญ่เป็นกลยุทธ์การลงทุนแบบใด,0
ลักษณะของกิจการเจ้าของคนเดียว คืออะไร,0
Securitization คืออะไร,0
บริษัทที่ทำธุรกิจขายกองทุนรวม คืออะไร,0
ตราสารหนี้ชนิดทยอยคืนเงินต้น (Amortizing Bond) คืออะไร,0
การลงทุนแบบเน้นการเติบโต (Growth Investing) มีวิธีการลงทุนอย่างไร,0
ปัจจัยที่ส่งผลต่อผลตอบแทนด้านความสามารถในการชำระหนี้ คืออะไร,0
ประโยชน์ของตลาดซื้อคืน คืออะไร,0
ก.ล.ต. ให้ข้อมูลอะไรบ้าง,0
ผู้ที่ออกพันธบัตรรัฐวิสาหกิจ คือผู้ใด,0
สูตร Current Yield คืออะไร,0
14.30 – 16.30 น. มีรายละเอียดอย่างไร,0
พัฒนาการของระบบการซื้อขายของตลาดหลักทรัพย์แห่งประเทศไทย เป็นอย่างไร,0
Warrant (ไทย) ส่งมอบ Physical อย่างไร,0
กองทุนรวมที่มีนโยบายขายคืนอัตโนมัติ แตกต่างจากนโยบายอื่นๆอย่างไร,0
ตัวอย่างข้อมูลสถิติที่สำคัญของหลักทรัพย์ที่ถูกวิเคราะห์ มีอะไรบ้าง,0
ตราสารหนี้ที่จ่ายดอกเบี้ยลอยตัว คืออะไร,0
กองทุนรวมตลาดเงิน (Money Market) คืออะไร,0
การได้มาของตราสารในครั้งแรกของ DW ได้มาอย่างไร,0
หากต้องการเก็งกำไรจากการซื้อจะขายเมื่อราคา Warrant เป็นอย่างไร,0
ตราสารหนี้แบ่งตามวิธีจ่ายดอกเบี้ย มีอะไรบ้าง,0
กระบวนการซื้อขายในตลาดตราสารหนี้ มีอะไรบ้าง,0
ปัจจัยสำคัญที่มีผลต่อมูลค่าของหุ้นมีอะไรบ้าง,0
สิทธิทางภาษีของ LTF คืออะไร,0
การได้มาของตราสารในครั้งแรกของ Warrant (ไทย) ได้มาอย่างไร,0
การประเมินมูลค่าแบบ Absolute Valuation คืออะไร,0
ประเภทของหุ้นส่วนมีอะไรบ้าง,0
การซื้อขายในตลาด TBX กำหนดราคาซื้อขายอย่างไร,0
NR หมายถึงอะไร,0
ธุรกรรมซื้อขายปกติ คืออะไร,0
ตราสารหนี้ที่มีหลักทรัพย์ค้ำประกัน (Secured Bond) คืออะไร,0
10.00 – 12.30 น. มีรายละเอียดอย่างไร,0
ความเสี่ยงจากการผิดนัดชำระหนี้ (Credit risk) คืออะไร,0
FITCH Rating (Thailand) ให้ข้อมูลใดบ้าง,0
NAV แสดงให้เห็นอะไร,0
ATO (at the open) คืออะไร,0
ลักษณะของบริษัทจำกัดมหาชน คืออะไร,0
การจ่ายเงินปันผล REITs ต้องจ่ายเท่าใด,0
XD คืออะไร,0
เกณฑ์การหยุดการซื้อขายชั่วคราว มีอะไรบ้าง,0
อัตราการจ่ายดอกเบี้ย (Coupon Rate) คืออะไร,0
กลยุทธ์การเข้าซื้อและขาย มีกี่กลยุทธ์,0
สิทธิ์ของผู้ถือหุ้นบุริมสิทธิ มีอะไรบ้าง,0
รูปแบบของกระแสเงินสด มีรูปแบบใดบ้าง,0
H คืออะไร,0
แบ่งประเภทกองทุนรวมตามลักษณะพิเศษ มีอะไรบ้าง,0
H หมายถึงอะไร,0
วิธีการชำระราคาและส่งมอบหลักทรัพย์แบบ Net Clearing คืออะไร,0
วัตถุประสงค์การออก DW คืออะไร,0
ตราสารหนี้แบบไม่มีใบตราสาร (Scripless) มีลักษณะอย่างไร,0
กองทุนทริกเกอร์ (Trigger Fund) คืออะไร,0
บทลงโทษตามความผิดของข้อบังคับของตลาดหลักทรัพย์ มีอะไรบ้าง,0
การกำกับดูแลการซื้อขายที่ดีส่งผลต่อผู้ลงทุนอย่างไร,0
แบ่งประเภทกองทุรรวมตามลักษณะการขายคืนหน่วยลงทุน มีอะไรบ้าง,0
ใครคือผู้ออกพันธบัตรธนาคารแห่งประเทศไทย,0
ตราสารหนี้จากการแปลงสินทรัพย์เป็นหลักทรัพย์ (Securitization) คืออะไร,0
ชื่อผู้ออก (Issuer) คืออะไร,0
SB คืออะไร,0
ระดับดังนี้ความเสี่ยงจากการกระจุกตัว มีระดับใดบ้าง,0
ประเภทของสิทธิของ Warrant (ไทย) คืออะไร,0
การทำ Portfolio Rebalancing มีกี่รูปแบบ ,0
ผู้ลงทุนสามารถตัดสินใจขายเมื่อใด,0
ลักษณะของห้างหุ้นส่วนจำกัด คืออะไร,0
RMF มีนโยบายการลงทุน อย่างไร,0
สมาคมตลาดตราสารหนี้ไทย ให้ข้อมูลอะไรบ้าง,0
Lease hold คืออะไร,0
ราคาหุ้นสามัญเพิ่มขึ้น ส่งผลอย่างไรกับราคาหุ้นกู้แปลงสภาพ,0
ความเสี่ยงทางการเงิน (Financial Risk) คืออะไร,0
เกณฑ์การขึ้นเครื่องหมาย H มีอะไรบ้าง,0
Warrant (ไทย) มี Credit Risk หรือไม่,0
ประเภทของบัญชีซื้อขาย มีกี่ประเภท,0
ตลาดซื้อคืนตราสารหนี้ คืออะไร,0
ตลาดตราสารหนี้ในไทย แบ่งออกเป็นอะไรบ้าง,0
งบการเงินที่สำคัญมีอะไรบ้าง,0
Web-based application แยกย่อยได้กี่ประเภท,0
DW ส่งมอบ Physical อย่างไร,0
REITs ต้องลงทุนในอสังหาฯ ที่มีมูลค่าเท่าใด,0
บริหารแบบเชิงรับ มีเป้าหมายการลงทุนอย่างไร,0
การซื้อขายแบบ OTC สามารถแบ่งตามเกณฑ์คู่ค้าได้กี่ประเภท,0
ผู้แทนผู้ถือหุ้นกู้ ทำหน้าที่อะไร,0
ตราสารหนี้มีการค้ำประกัน (Guaranteed Bond) คืออะไร,0
การประเมินมูลค่าของ Warrant (ไทย) มีอะไรบ้าง,0
ความเสี่ยงจากปัจจัยมหภาค (Macro Factor) คืออะไร,0
ผู้ลงทุนรายย่อย คืออะไร,0
เกณฑ์การรับจดทะเบียนตราสารหนี้ในตลาด TBX มีอะไรบ้าง,0
ตราสารหนี้ระยะสั้น คืออะไร,0
ข้อความที่ต้องเน้นให้เด่นชัดในสัญญาที่บริษัทหลักทรัพย์ทำกับลูกค้า มีอะไรบ้าง,0
การส่งมอบ DW คือวิธีใด,0
XP หมายถึงอะไร,0
การรับประกันการจัดจำหน่าย คืออะไร,0
อัตราผลตอบแทนถึงวันไถ่ถอนก่อนกำหนดจากผู้ลงทุน คืออะไร,0
การแบ่งกลุ่มผู้ลงทุนที่มิใช่รายย่อย (Accredited Investor: AI) มีอะไรบ้าง,0
กรณีที่ต่างประเทศเข้ามาลงทุนในตราสารหนี้ไทยเพิ่มขึ้น จะส่งผลอย่างไร,0
การติดตามและตรวจสอบการซื้อขายมีกี่ลักษณะ,0
Par Bond คืออะไร,0
กองทุนรวม คืออะไร,0
Mid-cap Stock คืออะไร,0
เงื่อนไขในการลงทุน ของ LTF คืออะไร,0
DW ต้องมีผู้ดูแลสภาพคล่องหรือไม่,0
ตราสารหนี้ที่ผู้ออกมีสิทธิไถ่ถอนคืนก่อนครบกำหนด (Callable Bond) คืออะไร,0
ตราสารหนี้แบบมีใบตราสาร (Scrip) มีลักษณะอย่างไร,0
ซื้อขายกองทุนเปิดเมื่อ IPO ผ่านช่องทางใด,0
ตราสารหนี้ คืออะไร,0
สำนักงานพัฒนาเศรษฐกิจและสังคมแห่งชาติ (สภาพัฒน์) ให้ข้อมูลอะไรบ้าง,0
สรุปข้อมูลสำคัญของตราสาร คืออะไร,0
ตราสารหนี้แบ่งตามการค้ำประกัน มีอะไรบ้าง,0
TB คืออะไร,0
กลุ่มตราสารหนี้ในตลาด TBX มีอะไรบ้าง,0
NVDR คืออะไร,0
การเลือกหมวดธุรกิจ (Sector Strategy) มีวิธีการเลือกอย่างไร,0
การคำนวณ YTP และ YTC แต่มีจุดต่างคืออะไร,0
ซื้อตราสารหนี้ เมื่อใด,0
Trustee คืออะไร,0
หลักการ TAA คืออะไร,0
XI หมายถึงอะไร,0
กองทุนรวมตราสารหนี้ระยะยาว (Long-Term Fixed-Income Fund) คืออะไร,0
อัตราดอกเบี้ยนโยบายเปลี่ยนแปลง จะส่งผลอย่างไร,0
การลงทุนที่เน้นลงทุนในหุ้นที่มีแนวโน้มการเติบโตของกำไรสูง เป็นกลยุทธ์การลงทุนแบบใด,0
กองทุนที่ได้สิทธิประโยชน์ทางภาษี คืออะไร,0
บัญชีเงินสดปกติ (Normal Cash) คืออะไร,0
ร้องเพลงคลายเครียด,1
พอดีผมอยากจะทราบสินเชื่อเพื่อการศึกษาครับ,1
อยากถามว่าเรียนสอนแกะงบการเงินเพื่อลงทุนในหุ้นที่ไหนดีครับ,1
การคิดดอกเบี้ยจากกรมบังคับคดี คิดเท่าไร,1
ขอวิธีเจรจากับเจ้าหนี้,1
พอดีบริษัททวงหนี้ JMT ขู่ว่าจะเพิ่มดอกเยอะๆทำได้ไหมครับ,1
เวลาหุ้นตกหนัก คุณคิดว่าสมควรขายหรือซื้อ,1
ตอนนี้ดอกเบี้ยฝากประจำธนาคารไหนดีสุดครับ,1
deposit ether for ดึงเงินคืนยังไง,1
ติดหนี้ติดสินของผู้อื่น มีสิทธิ์ติดคุกเสมอไปมั้ยครับ,1
ขอคำแนะนำสำหรับการกู้เงินมารีโนเวทบ้านค่ะ,1
ตั้งแต่ต้นปีมาห้องนี้ไม่น่าจะมีคนขาดทุนจริงมั๊ย,1
ปรึกษาเรื่อง ถ้ามีที่ดิน แล้วต้องการเงินด่วน ทำอย่างไร,1
หุ้นไทยยังมีหุ้นเด้งอยู่มั้ยครับ,1
กองทุน Rmf ขายยังไง,1
โดนโกง จากการกดลิงค์ บัตรกดเงินสด ต้องใช้คืนไหม,1
ต้องจ่ายค่าธรรมเนียมบัตรเครดิตภายในกี่วัน,1
ทางตันขนาดนี้ จะอยู่ต่อไปอย่างไง,1
อยากออกรถมือสองจัดกับธนาคารอะไรดอกน้อยที่สุดคับ ขอความรู้หน่อย,1
ใครเคยโดนเรียกเอกสารรับรองหักภาษีบ้างครับ,1
รับเงินประกันมิเตอร์ไฟฟ้าคืนทางการโอน ได้คืนภายในกี่วันครับ,1
อยากหาเงินแสนให้ได้ก่อน6เดือนครับ พอจะมีทางไหนบ้างครับ,1
ซื้อของมาใช้ แต่พอดีคิดเงินในนามบริษัทจะเป็นไรไหม,1
เช็คข้อมูลบัญชีเงินฝาก ทุกธนาคาร ที่ไหนได้บ้างครับ,1
โดนหลอกขายประกันจาก TVD Broker จะยกเลิกกรมธรรม์ยังไง,1
คุณคิดว่าบัตรสวัสดิการแห่งรัฐที่ประกาศผู้ได้สิทธิประมาณ 14 ล้านคน มันคือยอดจริงมากน้อยแค่ไหน,1
มีคนเช่าบ้านราคาสูงเท่าผ่อนเองไหม,1
นำเช็คไปขึ้นเงินกี่ชั่วโมงถึงจะใช้เงินได้,1
รหัสสาขาธนาคารกสิกรไทยดูยังไง,1
โอนเงิน QR ทรูมันนี่ เข้าพร้อมเพ แต่ปลายทางไม่ได้รับยอดต้องทำไงคะ,1
Lanna จะมีปันผลไหมคะ,1
ปัจจุบันมีธนาคารไหนเปิดบัญชีใหม่โดยไม่ต้องทำบัตร ATM ได้บ้าง,1
อยากสมัครพร้อมเพย์ต้องทำไงคะ,1
ปิดตาซื้อหุ้นวันนี้ ผมจะดอยไหมครับ,1
BVG ไม่รอแล้วนะ,1
มีคนเอาบัญชีไปรับเงินคนอื่นมาเเละกล่ะโกงทำไงดีคะ,1
Pdj ปันผลเป็นหุ้น และเงินสด น่าสนใจไหมครับ,1
ถ้าไม่มีบัตรเอทีเอ็มหรือบัตรกดเงินสดของกสิกรไทยใช้ App Kasikorn ได้ไหมครับ,1
Tidlor กับ singer ถ้าให้เลือก คุณจะเลือกซื้อตัวไหน,1
สอบถามกูรูเรื่องหุ้นกู้ RLTH กะ MJD ค่ะ,1
เขาเเลกเหรียญกันที่ไหนได้บ้างคับ,1
ขอคำแนะนำเรื่องการออมทองค่ะ,1
อยากร้องเรียน ทำไมการขอเพิ่มวงเงินถาวรของบัตร SCB ถึงยากเย็นและยุ่งยากขนาดนี้,1
ถ้าบัตรสวัสดิการเพิ่มเป็น 1000 ของจะแพงขึ้นมั้ยครับ,1
ตลาดหุ้นช่วง 1 เดือนที่ผ่านมาลงเกือบทุกวันเลยเป็นเพราะสาเหตุอะไรครับ,1
อยู่ๆ บัญชีเราก็โอนเงินให้ใครไม่รู้,1
เติมเกมขึ้นคืนเงินแล้วแต่ยังไม่ได้เงินคืนต้องรอกี่วันคะ,1
ค่าครองชีพคืออะไร?,1
วิธีไหนดีกว่ากันครับ,1
ฝาก Bitkub แต่ไม่สามารถใช้เงินได้เกิดจากอะไร,1
Gunkul ประกาศผลประกอบการหรือยังครับ,1
บัตรเครดิต ไม่เคยกดเปิดใช้ แล้วสามารถใช้ได้ด้วยเหรอ,1
tidlor ลงหนักมากเพราะอะไรหรอครับ,1
