question,cls
ใครเป็นผู้ออกตราสารหนี้ภาคเอกชน ไร้ใบตราสาร,0
Penny Stock หุ้นเหรียญ มีลักษณะอย่างไร,0
ราคาต้นงวดคืออะไร,0
อัตราการใช้สิทธิของ NVDR คือเท่าไหร่,0
หนังสือชี้ชวนส่วนสรุปข้อมูลสำคัญ (Fund Fact Sheet) คืออะไร,0
ข้อสัญญา (Covenants) คืออะไร,0
XT คืออะไร,0
Equity-Linked Product  คืออะไร,0
หลักเกณฑ์การขึ้นเครื่องหมาย  SP มีอะไรบ้าง,0
รายละเอียด เสนอขายกองทุนครั้งแรก (Initial Public Offering: IPO) มีอะไรบ้าง,0
ลักษณะสำคัญของกองทุนรวมสินค้าโภคภัณฑ์ในไทย มีอะไรบ้าง,0
ผู้ออกตั๋วเงินคลัง คือผู้ใด,0
รูปแบบของกระแสเงินสด มีกี่รูปแบบ,0
ประโยชน์ของกองทุนรวมต่อด้านตลาดการเงิน คืออะไร,0
สำนักหักบัญชี ทำหน้าที่อะไร,0
หนังสือชี้ชวนส่วนข้อมูลโครงการ คืออะไร,0
Feeder Fund คืออะไร,0
อายุของตราสาร ของ Warrant (ไทย) คือเท่าไหร่,0
SETSMART on Internet มีอะไรบ้าง,0
หลักการสำคัญในการคำนวณราคาเปิดและราคาปิด คืออะไร,0
สมมติฐานการนำดอกเบี้ยรับไปลงทุนต่อ คืออะไร,0
SETSMART on Extranet มีอะไรบ้าง,0
บริหารแบบเชิงรุกมีความเชื่ออย่างไร,0
LTF มีนโยบายการลงทุน อย่างไร,0
การซื้อแล้วถือยาว (Buy and Hold Strategy) มีวิธีการอย่างไร,0
ความเสี่ยงจากการลงทุนต่อ (Reinvestment risk) มีกี่ระดับ,0
บริหารแบบเชิงรุก มีวิธีการลงทุนอย่างไร,0
ตราสารหนี้แบ่งตามสิทธิแฝง มีอะไรบ้าง,0
Mid-cap Stock (หุ้นกลาง) คืออะไร,0
กองทุนรวมตราสารทุน (Equity Fund) คืออะไร,0
16.30 – 16.40 น. มีรายละเอียดอย่างไร,0
ผู้ที่ออกตั๋วแลกเงินและ หุ้นกู้ คือผู้ใด,0
Floor คืออะไร,0
CB คืออะไร,0
กลยุทธ์การจัดสรรสินทรัพย์ลงทุน (Asset Allocation) คืออะไร,0
กองทุนที่ได้สิทธิประโยชน์ทางภาษีในปัจจุบันมีกองทุนอะไรบ้าง,0
NP คืออะไร,0
ประโยชน์ของกองทุนรวมต่อด้านระบบเศรษฐกิจ คืออะไร,0
วิธีคิดลดกระแสเงินสดอิสระของกิจการ (Discounted Free Cash Flow to Firm) คืออะไร,0
เพราะเหตุใดผู้ลงทุนจึงไม่ควรซื้อ LTF และ RMF เกินสิทธิที่ได้รับการลดหย่อนภาษี,0
ตราสารหนี้ระยะยาว คืออะไร,0
กองทุนรวมที่มีความเสี่ยงต่างประเทศ คืออะไร,0
ความเสี่ยงของกองทุนอสังหาฯ มีอะไรบ้าง,0
Warrant ความหมายในไทยคืออะไร,0
การพยายามขายให้ดีที่สุด คืออะไร,0
ผู้เกี่ยวข้องกับตราสารหนี้ไทย มีกี่กลุ่ม,0
สิทธิ์ของผู้ถือหุ้นสามัญ มีอะไรบ้าง,0
หุ้นกู้แปลงสภาพ (Convertible Bond) คืออะไร,0
หน้าที่ของผู้รับฝากทรัพย์สิน คืออะไร,0
อายุของตราสาร ของ DW คือเท่าไหร่,0
ความเสี่ยงที่จะกระทบต่อความต้องการลงทุนในตราสารทุนมีอะไรบ้าง,0
บริหารแบบเชิงรับมีความเชื่ออย่างไร,0
อัตราส่วนที่ใช้วิเคราะห์ Warrant (ไทย) มีอะไรบ้าง,0
ลักษณะของสิทธิแฝง (Embedded Option) คืออะไร,0
ระดับความเสี่ยงของกองทุนรวมตามประเภทสินทรัพย์ มีอะไรบ้าง,0
XE คืออะไร,0
กองทุนรวมดัชนีกองทุนรวมดัชนี (Index Fund) คืออะไร,0
ที่มาและวัตถุประสงค์ของ RMF คืออะไร,0
เพราะเหตุใดผู้ลงทุนจึงควรทำ Portfolio Rebalancing,0
ในตลาด TBX ปรับช่วงราคาอย่างไร,0
XM คือออะไร,0
ตราสารหนี้แบ่งตามวิธีคืนเงินต้น มีอะไรบ้าง,0
กระทรวงพาณิชย์ ให้ข้อมูลอะไรบ้าง,0
XW คืออะไร,0
สูตรการคำนวณ NAV คืออะไร,0
ILB คืออะไร,0
การซื้อหุ้นด้วยจำนวนเงินเท่าๆ กันตามกำหนดเวลาโดยไม่สนใจว่าราคาจะเป็นเท่าไร เป็นกลยุทธ์การลงทุนแบบใด,0
ตราสารหนี้ที่จ่ายดอกเบี้ยคงที่ คืออะไร,0
Mega-cap Stock คืออะไร,0
ตราสารหนี้แบ่งตามอายุของตราสาร มีอะไรบ้าง,0
การลงทุนที่ลงทุนในหุ้นที่มีราคาต่ำกว่ามูลค่าที่แท้จริง เป็นกลยุทธ์การลงทุนแบบใด,0
ราคาต้นทุน คืออะไร,0
LTF มีการจ่ายปันผลอย่างไร,0
Cash Flow Based Approach (Income Based Approach) คืออะไร,0
ประโยชน์ของ NVDR คืออะไร,0
ที่มาและวัตถุประสงค์ ของ LTF คืออะไร,0
Defensive Stock หุ้นตั้งรับ มีลักษณะอย่างไร,0
ประเมินมูลค่าหุ้น คืออะไร,0
ผู้ลงทุนสถาบัน ตามประกาศของ ก.ล.ต. มีอะไรบ้าง,0
อัตราผลตอบแทนถึงวันไถ่ถอนก่อนกำหนดจากผู้ออก คืออะไร,0
สูตรการคำนวณ NAV per unit คืออะไร,0
บริหารแบบเชิงรุกมีเป้าหมายการลงทุนคืออะไร,0
หน้าที่ของกระทรวงการคลัง คืออะไร,0
บริหารแบบเชิงรับ มีวิธีการลงทุนอย่างไร,0
สมาคมตราสารหนี้ไทย มีหน้าที่อะไร,0
Liquidation Value (มูลค่าที่ขายทอดตลาดได้) คืออะไร,0
แหล่งที่มาของเงินทุนในการทำธุรกิจโดยทั่วไปมาจากแหล่งใด,0
การประเมินมูลค่า มีกี่ขั้นตอน,0
อัตราคิดลดคืออะไร,0
การลงทุนแบบสวนตลาด (Contrarian Investing Strategy) มีวิธีการลงทุนอย่างไร,0
สาเหตุของการระดมทุนด้วยตราสารหนี้ของภาครัฐและรัฐวิสาหกิจ คืออะไร,0
XB คืออะไร,0
ราคาหุ้นสามัญลดลงรุนแรงเนื่องจากบริษัทมีความเสี่ยงที่จะล้มละลาย ส่งผลอย่างไรกับหุ้นกู้แปลงสภาพ,0
RMF มีการจ่ายปันผลอย่างไร,0
วิธีคิดลดเงินปันผล (Dividend Discount Model :DDM) คืออะไร,0
การกำหนดสัดส่วนสินทรัพย์เชิงกลยุทธ์ (Strategic Asset Allocation: SAA) คืออะไร,0
กองทุนรวมที่มีความเสี่ยงทั้งในและต่างประเทศ คืออะไร,0
XR คืออะไร,0
หน้าที่ของสถาบันจัดอันดับความน่าเชื่อถือ คืออะไร,0
ผลตอบแทนของกองทุนรวมมีอะไรบ้าง,0
XN คืออะไร,0
ลักษณะสำคัญของกองทุนเปิด คืออะไร,0
Market timing (การจับจังหวะลงทุน) คืออะไร,0
16.40 – 17.00 น. มีรายละเอียดอย่างไร,0
BOT คืออะไร,0
กระทรวงการคลัง ให้ข้อมูลอะไรบ้าง,0
ธนาคารแห่งประเทศไทย ให้ข้อมูลอะไรบ้าง,0
สิทธิประโยชน์ทางภาษีของผู้ถือ NVDR ที่ผู้ลงทุนเป็นบุคคลธรรมดา คืออะไร,0
ที่ปรึกษาทางการเงิน ทำหน้าที่อะไร,0
วิธีคิดลดกระแสเงินสดอิสระของผู้ถือหุ้น (Discounted Free Cash Flow to Equity) คืออะไร,0
หน้าที่ของนายทะเบียน คืออะไร,0
วัตถุประสงค์การออก Warrant (ไทย) คืออะไร,0
Combined Method (ผสม) คืออะไร,0
สิทธิทางภาษีของ RMF คืออะไร,0
กองทุนรวมที่กำหนดระยะเวลาลงทุน (Term Fund) คืออะไร,0
Warrant (ไทย) ต้องมีผู้ดูแลสภาพคล่องหรือไม่,0
กลยุทธ์ที่เลือกกองทุนแบบ Passive เป็นส่วนใหญ่ และ ส่วนที่เหลือจะเลือกกองทุนแบบ Active คือกลยุทธ์อะไร,0
ขั้นตอนการคำนวณการประเมินมูลค่าด้วยวิธีคิดลดเงินปันผล มีกี่ขั้นตอน,0
ตราสารหนี้แบ่งตามผู้ออกตราสาร มีอะไรบ้าง,0
เวลาการซื้อขายในตลาด TBX คือช่วงเวลาใดบ้าง,0
Warrant (ไทย) มีภาษีเมื่อมีการส่งมอบหรือไม่,0
Small-cap Stock คืออะไร,0
ราคาของกองทุน คืออะไร,0
การประเมินมูลค่าตราสารหนี้ที่ไม่จ่ายดอกเบี้ย ทำอย่างไร,0
Speculative Stock หุ้นเก็งกำไร มีลักษณะอย่างไร,0
Income Stock / Dividend Stock หุ้นปันผล มีลักษณะอย่างไร,0
ใครเป็นผู้ออกตราสารหนี้ภาคเอกชน มีใบตราสาร,0
การลงทุนแบบเน้นคุณค่า (Value Investing) มีวิธีการอย่างไร,0
สาเหตุของการระดมทุนด้วยตราสารหนี้ของภาคเอกชน คืออะไร,0
คณะกรรมการกำหนดนโยบายการเงิน (กนง.) มีกี่คน ใครบ้าง,0
ตราสารหนี้แบ่งตามลักษณะการถือ มีอะไรบ้าง,0
สำนักงานบริหารหนี้สาธารณะ ให้ข้อมูลอะไรบ้าง,0
หลักเกณฑ์ในการเปิดบัญชีซื้อขายหลักทรัพย์ ทำอย่างไร,0
ใช้เจ้าหน้าที่วิเคราะห์ข้อมูลการซื้อขายอย่างไร,0
NVRD อ้างอิงกับหลักทรัพย์ประเภทใดได้บ้าง,0
ความเสี่ยงจากอัตราแลกเปลี่ยน (Exchange rate risk / Currency risk) คืออะไร,0
การคำนวณ YTC และ YTM แต่มีจุดต่างกัน กี่จุด,0
Warrant ความหมายโดยสากลคืออะไร,0
เวลาในการซื้อขายหลักทรัพย์ มีรายละเอียดอย่างไร,0
ผลตอบแทนและความเสี่ยงของ NVDR คืออะไร,0
วันครบกำหนดไถ่ถอน (Maturity Date) คืออะไร,0
สิทธิประโยชน์ทางภาษีของผู้ถือ NVDR ที่ผู้ลงทุนเป็นนิติบุคลที่จัดตั้งขึ้นตามกฎหมายต่างประเทศ คืออะไร,0
การจับคู่หุ้น (Pairs Trading) มีวิธีการอย่างไร,0
การหยุดความเสียหาย (Stop Loss) มีวิธีการอย่างไร,0
แบ่งประเภทกองทุนรวมตามนโยบายการจ่ายผลตอบแทน มีอะไรบ้าง,0
ST คืออะไร,0
แบ่งประเภทกองทุนรวมตามนโยบายการลงทุน มีอะไรบ้าง,0
รูปแบบการใช้สิทธิของ DW คืออะไร,0
LB คืออะไร,0
ประเภทของหุ้นบุริมสิทธิ มีอะไรบ้าง,0
กระบวนการตรวจสอบการเปิดบัญชีหลักทรัพย์มีวิธีใดบ้าง,0
Cyclical Stock หุ้นวัฏจักร มีลักษณะอย่างไร,0
หุ้นบุริมสิทธิ (Preferred Stock) คืออะไร,0
หุ้นกู้ต่างประเทศ (Foreign Bond) คืออะไร,0
เงื่อนไขในการลงทุนของ RMF คืออะไร,0
การส่งมอบ Warrant (ไทย) คือวิธีใด,0
Small-cap Stock (หุ้นเล็ก) คืออะไร,0
การประเมินมูลค่า มีขั้นตอนอะไรบ้าง,0
Free hold คืออะไร,0
หากปริมาณการออกตราสารหนี้ในตลาดแรกมีสูง หมายความว่าอย่างไร,0
แบ่งประเภทกองทุนรวมตามความเสี่ยงต่างประเทศ มีอะไรบ้าง,0
การเข้าซื้อ ด้วยจำนวนเงินเท่าๆ กัน ในช่วงเวลาที่กำหนด คือกลยุทธ์อะไร,0
NC คืออะไร,0
Nano-Cap Stock คืออะไร,0
ความสามารถของการใช้ระบบใช้ระบบคอมพิวเตอร์ (WATCHs) คืออะไร,0
Micro-cap Stock คืออะไร,0
ความเสี่ยงเมื่อลงทุนต่างประเทศ คืออะไร,0
ความเสี่ยงที่จะกระทบต่อผลการดำเนินงาน มีอะไรบ้าง,0
14.00 – 14.30 น. มีรายละเอียดอย่างไร,0
สูตรการคำนวณ เงินปันผล คืออะไร,0
กองทุนรวมตราสารหนี้ระยะสั้น (Short-Term Fixed-Income Fund) คืออะไร,0
หุ้นกู้ยูโร (Euro Bond) คืออะไร,0
TRIS Rating ให้ข้อมูลใดบ้าง,0
กลยุทธ์ที่เลือกกองทุนแบบ Passive ทั้งหมด เพื่อสร้างผลตอบแทนใกล้เคียงกับดัชนีที่สุด คือกลยุทธ์อะไร,0
ประเภทของสิทธิของ DW คืออะไร,0
ราคาปลายงวด คืออะไร,0
NVDR ที่อ้างอิงกับหุ้นสามัญ ต้องมีการรายงานการถือครองอะไรบ้าง,0
ที่มาของเงินทุนในการทำธุรกิจมาจากแหล่งใดบ้าง,0
กองทุนรวมสินทรัพย์ทางเลือก (Alternative Investment Fund) คืออะไร,0
ความเสี่ยงทางธุรกิจ (Business Risk) คืออะไร,0
NR คืออะไร,0
ใครคือผู้ออกตราสาร Warrant (ไทย),0
ข้อบังคับของตลาดหลักทรัพย์ที่กำหนดว่าลักษณะของคำสั่งซื้อขายที่ไม่เหมาะสมมีอะไรบ้าง,0
มูลค่าตลาด คืออะไร,0
เครื่องมือการลงทุนที่เข้ามาทดแทนกองทุนรวมอสังหาริมทรัพย์ที่ไม่สามารถจัดตั้ง และเพิ่มทุนได้อีก คืออะไร,0
SP หมายถึงอะไร,0
9.30 – 10.00 น. มีรายละเอียดอย่างไร,0
SP คืออะไร,0
ผู้ลงทุนสามารถตัดสินใจถือ/อยู่เฉยๆเมื่อใด,0
กองทุนรวมที่ไม่มีความเสี่ยงต่างประเทศ คืออะไร,0
ช่องทางการส่งคำสั่งซื้อขาย แบ่งตามประเภทผู้ซื้อ มีอะไรบ้าง,0
กองทุนรวมโครงสร้างพื้นฐาน (Infrastructure Fund) คืออะไร,0
กองทุนเปิดจะต้องเลิกโครงการเมื่อใด,0
อัตราผลตอบแทนจากดอกเบี้ย คืออะไร,0
พันธบัตรชดเชยเงินเฟ้อ (Inflation-Linked bond) คืออะไร,0
DW มีภาษีเมื่อมีการส่งมอบหรือไม่,0
ผู้ลงทุนรายใหญ่ คืออะไร,0
บัญชีมาร์จิ้น (Margin Account) คืออะไร,0
ผู้ลงทุนรายใหญ่ที่เป็นบุคคลธรรมดา ต้องมีรายได้เท่าไหร่,0
ความเสี่ยงต่อระดับความต้องของการลงทุนในตราสารทุนคืออะไร,0
Large-cap Stock (หุ้นใหญ่) คืออะไร,0
อัตราส่วนที่ใช้วิเคราะห์ DW มีอะไรบ้าง,0
ประเภทของตราสารทุน มีอะไรบ้าง,0
ความเสี่ยงจากการลงทุนต่อ (Reinvestment risk) มีอะไรบ้าง,0
ผู้ลงทุนรายใหญ่พิเศษ คืออะไร,0
รูปแบบการใช้สิทธิของ Warrant (ไทย) คืออะไร,0
Premium Bond คืออะไร,0
SET Connect คืออะไร,0
ใครคือผู้ออกพันธบัตรรัฐบาล,0
วิธีการบริหารการลงทุนของกองทุนรวม มีกี่ประเภท,0
กองทุนผสม (Mixed Fund) คืออะไร,0
จุดเด่นของระบบ SET Connect คืออะไร,0
ตราสารหนี้แบ่งตามสิทธิเรียกร้อง มีอะไรบ้าง,0
ความเสี่ยงด้านสภาพคล่อง (Liquidity risk) มีอะไรบ้าง,0
กองทุนรวมคุ้มครองเงินต้น (Capital Protection Fund) คืออะไร,0
ตราสารหนี้ที่ผู้ลงทุนมีสิทธิเรียกคืนเงินกู้ก่อนครบกำหนด (Puttable Bond) คืออะไร,0
ข้อเสียของ Book Value (มูลค่าตามบัญชี) คืออะไร,0
มูลค่าหน้าตั๋ว/มูลค่าที่ตราไว้ (Face Value/Par Value) คืออะไร,0
การรับซื้อหลักทรัพย์ที่เหลือเพื่อขายต่อ คืออะไร,0
Asset Based Approach คืออะไร,0
ความเสี่ยงต่อผลการดำเนินงานของกิจการ คืออะไร,0
สูตรการคำนวณ อัตราผลตอบแทนรวม คืออะไร,0
หนังสือชี้ชวนส่วนสรุปข้อมูลสำคัญ (Fund Fact Sheet) ทำให้ผู้ลงทุนทราบอะไรบ้าง,0
มาตรการการป้องกันไม่ให้เกิดการซื้อขายที่ไม่เป็นธรรม มีอะไรบ้าง,0
สิทธิประโยชน์ของผู้ถือ NVDR มีอะไรบ้าง,0
บทวิเคราะห์เชิงลึกควรมีองค์ประกอบเพิ่มเติมอะไรบ้าง,0
ตลาดหลักทรัพย์แห่งประเทศไทย ให้ข้อมูลอะไรบ้าง,0
สูตรการคำนวณ Capital gain คืออะไร,0
Fund of Funds คืออะไร,0
ประเภทของกองทุนรวม แบ่งตามเกณฑ์มีกี่เกณฑ์,0
ความเสี่ยงจากผู้จัดการกองทุน (Fund manager risk) คืออะไร,0
รายได้หลักของกองทุนรวมโครงสร้างพื้นฐานมาจากที่ใด,0
ธุรกรรมซื้อคืน คืออะไร,0
Large-cap Stock คืออะไร,0
อัตราดอกเบี้ยนโยบาย คืออะไร,0
อัตราผลตอบแทนถึงวันครบกำหนด คืออะไร,0
